{
 "version": 1,
 "name": "example-picnic-area",
 "kit": "kit/props.glb",
 "note": "Proof file for docs/rc-placements.md. Picnic lawn in the infield of the Neighbourhood Run, 62 m south of the residential skatepark start; centre (-3048, -838), y snapped to ground.",
 "palette": ["#ffffff", "#ff9e8c", "#8fb8ff", "#a8e48e", "#ffe28a", "#d6c4ff"],
 "items": [
  {"prop": "picnic-table", "pos": [-3056, null, -842], "yaw": 4, "scale": 1, "variant": 0, "collide": true},
  {"prop": "picnic-table", "pos": [-3048, null, -842], "yaw": -6, "scale": 1, "variant": 0, "collide": true},
  {"prop": "picnic-table", "pos": [-3040, null, -842], "yaw": 3, "scale": 1, "variant": 0, "collide": true},
  {"prop": "picnic-table", "pos": [-3056, null, -834], "yaw": -3, "scale": 1, "variant": 0, "collide": true},
  {"prop": "picnic-table", "pos": [-3048, null, -834], "yaw": 7, "scale": 1, "variant": 0, "collide": true},
  {"prop": "picnic-table", "pos": [-3040, null, -834], "yaw": -5, "scale": 1, "variant": 0, "collide": true},
  {"prop": "bench", "pos": [-3057, null, -848], "yaw": 180, "scale": 1, "variant": 0, "collide": true},
  {"prop": "bench", "pos": [-3048, null, -848], "yaw": 180, "scale": 1, "variant": 0, "collide": true},
  {"prop": "bench", "pos": [-3039, null, -848], "yaw": 180, "scale": 1, "variant": 0, "collide": true},
  {"prop": "bench", "pos": [-3057, null, -828], "yaw": 0, "scale": 1, "variant": 0, "collide": true},
  {"prop": "bench", "pos": [-3048, null, -828], "yaw": 0, "scale": 1, "variant": 0, "collide": true},
  {"prop": "bench", "pos": [-3039, null, -828], "yaw": 0, "scale": 1, "variant": 0, "collide": true},
  {"prop": "bin", "pos": [-3062, null, -848], "yaw": 0, "scale": 1, "variant": 0, "collide": true},
  {"prop": "bin", "pos": [-3034, null, -848], "yaw": 0, "scale": 1, "variant": 3, "collide": true},
  {"prop": "bin", "pos": [-3062, null, -828], "yaw": 0, "scale": 1, "variant": 3, "collide": true},
  {"prop": "bin", "pos": [-3034, null, -828], "yaw": 0, "scale": 1, "variant": 0, "collide": true},
  {"prop": "street-lamp", "pos": [-3064, null, -838], "yaw": -90, "scale": 1, "variant": 0, "collide": true},
  {"prop": "street-lamp", "pos": [-3032, null, -838], "yaw": 90, "scale": 1, "variant": 0, "collide": true},
  {"prop": "chain-link-fence-panel", "pos": [-3067, null, -845.5], "yaw": 90, "scale": 1, "variant": 0, "collide": true},
  {"prop": "chain-link-fence-panel", "pos": [-3067, null, -842.5], "yaw": 90, "scale": 1, "variant": 0, "collide": true},
  {"prop": "chain-link-fence-panel", "pos": [-3067, null, -839.5], "yaw": 90, "scale": 1, "variant": 0, "collide": true},
  {"prop": "chain-link-fence-panel", "pos": [-3067, null, -836.5], "yaw": 90, "scale": 1, "variant": 0, "collide": true},
  {"prop": "chain-link-fence-panel", "pos": [-3067, null, -833.5], "yaw": 90, "scale": 1, "variant": 0, "collide": true},
  {"prop": "chain-link-fence-panel", "pos": [-3067, null, -830.5], "yaw": 90, "scale": 1, "variant": 0, "collide": true},
  {"prop": "traffic-cone", "pos": [-3029.1, null, -850], "yaw": 0, "scale": 1, "variant": 0, "collide": true},
  {"prop": "traffic-cone", "pos": [-3026.9, null, -847.4], "yaw": 0, "scale": 1, "variant": 0, "collide": true},
  {"prop": "traffic-cone", "pos": [-3029.1, null, -844.8], "yaw": 0, "scale": 1, "variant": 0, "collide": true},
  {"prop": "traffic-cone", "pos": [-3026.9, null, -842.2], "yaw": 0, "scale": 1, "variant": 0, "collide": true},
  {"prop": "traffic-cone", "pos": [-3029.1, null, -839.6], "yaw": 0, "scale": 1, "variant": 0, "collide": true},
  {"prop": "traffic-cone", "pos": [-3026.9, null, -837], "yaw": 0, "scale": 1, "variant": 0, "collide": true},
  {"prop": "traffic-cone", "pos": [-3029.1, null, -834.4], "yaw": 0, "scale": 1, "variant": 0, "collide": true},
  {"prop": "traffic-cone", "pos": [-3026.9, null, -831.8], "yaw": 0, "scale": 1, "variant": 0, "collide": true},
  {"prop": "traffic-cone", "pos": [-3029.1, null, -829.2], "yaw": 0, "scale": 1, "variant": 0, "collide": true},
  {"prop": "traffic-cone", "pos": [-3026.9, null, -826.6], "yaw": 0, "scale": 1, "variant": 0, "collide": true},
  {"prop": "bollard", "pos": [-3050, null, -824], "yaw": 0, "scale": 1, "variant": 0, "collide": true},
  {"prop": "bollard", "pos": [-3046, null, -824], "yaw": 0, "scale": 1, "variant": 0, "collide": true},
  {"prop": "jersey-barrier", "pos": [-3056, null, -852], "yaw": 0, "scale": 1, "variant": 0, "collide": true},
  {"prop": "jersey-barrier", "pos": [-3040, null, -852], "yaw": 4, "scale": 1, "variant": 0, "collide": true},
  {"prop": "sign-post", "pos": [-3048, null, -822], "yaw": 180, "scale": 1, "variant": 0, "collide": true}
 ]
}
